{
  "protocol_version": "cpo-contracts@0.1.0",
  "decision_id": "D-EXAMPLE-001",
  "statement": "Adopt structured logging.",
  "context": "Improve incident diagnosis.",
  "success_criteria": [
    "On-call can diagnose incidents faster."
  ],
  "rollback_trigger": "If log volume exceeds budget for 7 days.",
  "confidence": "medium",
  "created_at": "2026-01-25T12:00:00+00:00",
  "created_by": "user:example"
}